{
  "$schema": "http://json-schema.org/draft-07/schema#",
  "title": "Site Configuration",
  "description": "Configuration schema for the website engine",
  "type": "object",
  "properties": {
    "theme": {
      "type": "string",
      "description": "The theme to use for the website",
      "default": "default"
    },
    "language": {
      "type": "string",
      "description": "The default language for the website",
      "default": "en"
    },
    "plugins": {
      "type": "object",
      "description": "Plugin configuration",
      "patternProperties": {
        "^[a-zA-Z0-9-_]+$": {
          "type": "object",
          "properties": {
            "enabled": {
              "type": "boolean",
              "description": "Whether the plugin is enabled"
            },
            "config": {
              "description": "Plugin-specific configuration"
            }
          },
          "required": [
            "enabled"
          ],
          "additionalProperties": true
        }
      }
    },
    "site": {
      "type": "object",
      "description": "Basic site information",
      "properties": {
        "title": {
          "type": "string",
          "description": "The site title"
        },
        "description": {
          "type": "string",
          "description": "The site description"
        },
        "url": {
          "type": "string",
          "format": "uri",
          "description": "The site URL"
        }
      },
      "required": [
        "title",
        "description",
        "url"
      ],
      "additionalProperties": false
    },
    "favicon": {
      "type": "string",
      "description": "Path to the favicon file",
      "default": "/favicon.ico"
    },
    "thumbnail": {
      "type": "string",
      "description": "Path to the thumbnail image file"
    },
    "llms": {
      "type": "object",
      "description": "Overrides for the generated /llms.txt. Every field is optional; the build derives a default from site and header when a field is absent.",
      "properties": {
        "description": {
          "type": "string",
          "description": "One-paragraph description of the site, overriding site.description"
        },
        "when-to-use": {
          "type": "array",
          "description": "Concrete jobs an agent would come to this site for",
          "items": {
            "type": "string"
          }
        },
        "links": {
          "type": "array",
          "description": "Named links for agents, overriding the ones derived from the header navigation",
          "items": {
            "type": "object",
            "properties": {
              "title": {
                "type": "string"
              },
              "href": {
                "type": "string"
              }
            },
            "required": ["title", "href"],
            "additionalProperties": false
          }
        }
      },
      "additionalProperties": false
    },
    "header": {
      "type": "object",
      "description": "Header configuration",
      "properties": {
        "logo": {
          "type": "object",
          "description": "Logo configuration",
          "properties": {
            "src": {
              "type": "string",
              "description": "Logo image source"
            },
            "alt": {
              "type": "string",
              "description": "Logo alt text"
            },
            "href": {
              "type": "string",
              "description": "Logo link href"
            }
          },
          "required": [
            "src",
            "alt",
            "href"
          ],
          "additionalProperties": false
        },
        "opensource-navigation": {
          "type": "object",
          "description": "Open source navigation configuration",
          "properties": {
            "tabs": {
              "type": "array",
              "description": "Open source navigation tabs",
              "items": {
                "$ref": "#/definitions/tab"
              }
            }
          },
          "required": [
            "tabs"
          ],
          "additionalProperties": false
        },
        "navigation": {
          "type": "object",
          "description": "Navigation configuration",
          "properties": {
            "position": {
              "type": "string",
              "enum": [
                "header",
                "aside"
              ],
              "description": "Navigation position",
              "default": "header"
            },
            "tabs": {
              "type": "array",
              "description": "Navigation tabs",
              "items": {
                "$ref": "#/definitions/tab"
              }
            }
          },
          "required": [
            "tabs"
          ],
          "additionalProperties": false
        },
        "mobile-navigation-footer": {
          "type": "object",
          "description": "Mobile navigation footer configuration",
          "properties": {
            "email": {
              "type": "string",
              "format": "email",
              "description": "Contact email for mobile footer"
            },
            "socials": {
              "$ref": "#/definitions/socials"
            }
          },
          "required": [
            "email"
          ],
          "additionalProperties": false
        }
      },
      "required": [
        "logo",
        "navigation"
      ],
      "additionalProperties": false
    },
    "footer": {
      "type": "object",
      "description": "Footer configuration",
      "properties": {
        "global": {
          "type": "object",
          "description": "Global footer information",
          "properties": {
            "text": {
              "type": "string",
              "description": "Copyright or global text"
            },
            "email": {
              "type": "string",
              "format": "email",
              "description": "Contact email"
            },
            "socials": {
              "$ref": "#/definitions/socials"
            }
          },
          "required": [
            "text",
            "email"
          ],
          "additionalProperties": false
        },
        "column-sections": {
          "type": "array",
          "description": "Footer column sections",
          "items": {
            "$ref": "#/definitions/footerColumnSection"
          }
        },
        "sections": {
          "type": "array",
          "description": "Footer sections",
          "items": {
            "$ref": "#/definitions/footerColumnSection"
          }
        }
      },
      "additionalProperties": false
    },
    "404": {
      "type": "object",
      "description": "404 page configuration",
      "properties": {
        "description": {
          "type": "string",
          "description": "Description text for the 404 page"
        },
        "image": {
          "type": "string",
          "description": "Path to the 404 page image"
        },
        "buttons": {
          "type": "array",
          "description": "Action buttons for the 404 page",
          "items": {
            "type": "object",
            "properties": {
              "text": {
                "type": "string",
                "description": "Button text"
              },
              "href": {
                "type": "string",
                "description": "Button URL"
              },
              "type": {
                "type": "string",
                "enum": [
                  "link",
                  "outline",
                  "primary",
                  "secondary",
                  "ghost"
                ],
                "description": "Button type/style"
              }
            },
            "required": [
              "text",
              "href",
              "type"
            ],
            "additionalProperties": false
          }
        }
      },
      "required": [
        "description"
      ],
      "additionalProperties": false
    }
  },
  "required": [
    "theme",
    "language",
    "site",
    "header"
  ],
  "additionalProperties": true,
  "definitions": {
    "tab": {
      "type": "object",
      "properties": {
        "tab": {
          "type": "string",
          "description": "Tab label"
        },
        "default-expanded": {
          "type": "boolean",
          "description": "Whether the tab is expanded by default"
        },
        "href": {
          "type": "string",
          "description": "Tab URL"
        },
        "type": {
          "oneOf": [
            {
              "type": "string"
            },
            {
              "type": "array",
              "items": {
                "type": "string"
              }
            }
          ],
          "description": "Tab type (e.g., button, primary)"
        },
        "tag": {
          "type": "string",
          "description": "Tag for the tab (e.g., new, beta)"
        },
        "groups": {
          "type": "array",
          "description": "Tab groups for dropdown navigation",
          "items": {
            "oneOf": [
              {
                "type": "object",
                "description": "Simple group with pages",
                "properties": {
                  "group": {
                    "type": "string",
                    "description": "Group name"
                  },
                  "tag": {
                    "type": "string",
                    "description": "Group tag"
                  },
                  "href": {
                    "type": "string",
                    "description": "Group URL"
                  },
                  "default-expanded": {
                    "type": "boolean",
                    "description": "Whether the tab is expanded by default"
                  },
                  "pages": {
                    "type": "array",
                    "description": "Pages in the group",
                    "items": {
                      "oneOf": [
                        {
                          "type": "string"
                        },
                        {
                          "type": "array",
                          "items": {
                            "type": "string"
                          },
                          "minItems": 2,
                          "maxItems": 2
                        }
                      ]
                    }
                  }
                },
                "required": [
                  "group",
                  "pages"
                ],
                "additionalProperties": false
              },
              {
                "type": "object",
                "description": "Nested group structure",
                "properties": {
                  "groups": {
                    "type": "array",
                    "description": "Nested groups",
                    "items": {
                      "type": "object",
                      "properties": {
                        "group": {
                          "type": "string",
                          "description": "Group name"
                        },
                        "default-expanded": {
                          "type": "boolean",
                          "description": "Whether the tab is expanded by default"
                        },
                        "tag": {
                          "type": "string",
                          "description": "Group tag"
                        },
                        "href": {
                          "type": "string",
                          "description": "Group URL"
                        },
                        "pages": {
                          "type": "array",
                          "description": "Pages in the group",
                          "items": {
                            "oneOf": [
                              {
                                "type": "string"
                              },
                              {
                                "type": "array",
                                "items": {
                                  "type": "string"
                                },
                                "minItems": 2,
                                "maxItems": 2
                              }
                            ]
                          }
                        }
                      },
                      "required": [
                        "group",
                        "pages"
                      ],
                      "additionalProperties": false
                    }
                  }
                },
                "required": [
                  "groups"
                ],
                "additionalProperties": false
              }
            ]
          }
        }
      },
      "required": [
        "tab"
      ],
      "additionalProperties": false
    },
    "socials": {
      "type": "object",
      "description": "Social media links",
      "patternProperties": {
        "^[a-zA-Z0-9-_]+$": {
          "oneOf": [
            {
              "type": "string",
              "description": "Social media URL"
            },
            {
              "type": "array",
              "items": {
                "type": "string"
              },
              "minItems": 2,
              "maxItems": 3,
              "description": "Social media [url, icon] or [url, icon, label]"
            }
          ]
        }
      }
    },
    "footerColumnSection": {
      "type": "object",
      "properties": {
        "title": {
          "type": "string",
          "description": "Section title"
        },
        "href": {
          "type": "string",
          "description": "Section URL"
        },
        "hide-title": {
          "type": "boolean",
          "description": "Whether to hide the section title"
        },
        "content": {
          "type": "array",
          "description": "Section content",
          "items": {
            "type": "object",
            "properties": {
              "type": {
                "type": "string",
                "description": "Content type"
              },
              "title": {
                "type": "string",
                "description": "Content title"
              },
              "text": {
                "type": "string",
                "description": "Content text"
              }
            },
            "required": [
              "type",
              "title",
              "text"
            ],
            "additionalProperties": false
          }
        },
        "socials": {
          "$ref": "#/definitions/socials"
        },
        "tabs": {
          "type": "array",
          "description": "Section tabs",
          "items": {
            "type": "object",
            "properties": {
              "tab": {
                "type": "string",
                "description": "Tab label"
              },
              "href": {
                "type": "string",
                "description": "Tab URL"
              },
              "type": {
                "type": "array",
                "items": {
                  "type": "string"
                },
                "description": "Tab type"
              },
              "tag": {
                "type": "string",
                "description": "Tab tag"
              }
            },
            "required": [
              "tab",
              "href"
            ],
            "additionalProperties": false
          }
        }
      },
      "additionalProperties": false
    }
  }
}
